<?xml version="1.0" encoding="ISO-8859-1"?>
<!DOCTYPE xproperties SYSTEM "xproperties.dtd" >
<xproperties>
 <property name="plugin.PHPPlugin.name" value="PHP" />
 <property name="plugin.PHPPlugin.author" value="Nicolas Thouvenin" />
 <property name="plugin.PHPPlugin.version" value="1.1" />
 <property name="PHP_menu" value="phpbrowse - phpquickopen - phpindenter  phpblocindenter - phpbeautifier phpblocbeautifier - phpcomplete" />
 <property name="PHP_menu.label" value="PHP" />

 <property name="plugin.PHPPlugin.modes" value="php3" />

  <property name="phpbrowse.label" value="Source Browser" />
  <property name="phpbrowse.shortcut" value="C+p C+b" />

 <property name="phpindenter.label" value="Indent File" />

 <property name="phpblocindenter.label" value="Indent Block" />
 <property name="phpblocindenter.shortcut" value="C+p C+i" />

 <property name="phpbeautifier.label" value="Beautifier File" />

 <property name="phpblocbeautifier.label" value="Beautifier Block" />
 <property name="phpblocbeautifier.shortcut" value="C+p C+p" />

 <property name="phpquickopen.label" value="Quick Open" />
 <property name="phpquickopen.shortcut" value="C+p C+o" />

 <property name="phpcomplete.label" value="Complete Function" />
 <property name="phpcomplete.shortcut" value="C+p C+/" />
</xproperties>
