<?xml version="1.0" encoding="UTF-8"?>
<!DOCTYPE xproperties SYSTEM "xproperties.dtd" >

<xproperties>
  <property name="plugin.HTMLPlugin.name" value="HTML" />
  <property name="plugin.HTMLPlugin.author" value="Romain Guy" />
  <property name="plugin.HTMLPlugin.version" value="1.3.1" />

  <property name="plugin.HTMLPlugin.modes" value="html" />

  <property name="HTML_menu" value="to_accents to_entities - next_tag previous_tag - indent_html" />
  <property name="HTML_menu.label" value="HTML" />
  <property name="to_accents.label" value="Entities To Accents" />
  <property name="to_entities.label" value="Accents To Entities" />
  <property name="next_tag.label" value="Find Next Tag" />
  <property name="next_tag.shortcut" value="C+t C+n" />
  <property name="previous_tag.label" value="Find Previous Tag" />
  <property name="previous_tag.shortcut" value="C+t C+p" />
  <property name="indent_html.label" value="Indent HTML" />

  <property name="html.indenter.maxLineWidth" value="80" />
  <property name="html.indenter.title" value="HTML Indenter" />
  <property name="html.indenter.maxLineWidth.label" value="Max line width:\w\w" />
  <property name="options.html.indenter.label" value="Indenter" />

  <property name="html.completion.title" value="HTML Completion" />
  <property name="options.html.completion.label" value="Completion" />
  <property name="html.completion.xhtmlCompliance" value="on" />
  <property name="html.completion.xhtmlCompliance.label" value="Follow XHTML recommendation" />
  <property name="html.completion.expandFullTag" value="on" />
  <property name="html.completion.expandFullTag.label" value="Expand to full tag (opening and closing)" />
  <property name="html.completion.activateTool" value="on" />
  <property name="html.completion.activateTool.label" value="Activate completion (need restart)" />

  <property name="options.html.label" value="HTML" />

  <property name="completeEntity.list.title" value="Insert entity:" />
  <property name="completeTag.list.title" value="Insert tag:" />
</xproperties>
